{
  "schema_id": "IG_DECODER_BASELINE_IDENTITY_V1",
  "decoder_version": "0.26.0",
  "archive_sha256": "0412a490488c785f2c7846e953f9316a4d2ccfd9b12cc5d72327c6440eb4b45f",
  "source_sha256": "71d13cec323def599e0489a41068bba75d4569ae4b104234c66f2a51383c1369",
  "role": "ONLY_V0_26_COMPARISON_ORACLE",
  "semantic_status": "FROZEN_NO_REWRITE"
}
